normalized_vendor_name,original_vendor_name
MEGGITT,MEGGITT TRAINING SYSTEMS (QUEBEC) INC
MEGGITT,Meggitt Training Systems Canada
MEGGITT,MEGGITT TRAINING SYSTEMS CANADA
MEGGITT,MEGGITT TRAINING SYSTEMS CANADA INC.
MEGGITT,Meggitt Training Systems (Quebec) I
MEGGITT,MEGGITT TRAINING SYSTEMS INC
MEGGITT,Meggitt Training Systems (Québec) Inc.
MEGGITT,MEGGITT DEFENCE SYSTEMS CANADA INC.
MEGGITT,Meggitt Defence Systems Canada
MEGGITT,MEGGITT TRAINING SYSTEMS
MEGGITT,Meggitt Training Systems Inc.
MEGGITT,MEGGITT TRAINING SYSTEMS CANADA INC
MEGGITT,MEGGITT TARGET SYSTEMS
MEGGITT,Meggitt Trainning Systems
MEGGITT,MEGGITT TRAINING SYSTEM INC
MEGGITT,MEGGITT TRAINING SYSTEMS (QUÉBEC)
MEGGITT,MEGGITT TRAINING SYSTES
MEGGITT,Meggitt Training Systems (Quebec) Inc.
MEGGITT,MEGGITT
MEGGITT,Meggitt Training Systems
