normalized_vendor_name,original_vendor_name
LYNLEY CONTRACTING SERVICES,Lynley Contracting Services Ltd.
LYNLEY CONTRACTING SERVICES,Lynley Contracting Servicesw Ltd.
LYNLEY CONTRACTING SERVICES,Lynley Contractor Services Ltd.
LYNLEY CONTRACTING SERVICES,LYNLEY CONTRACTING SERVICES
LYNLEY CONTRACTING SERVICES,Lynley Contracting Services Ltd
LYNLEY CONTRACTING SERVICES,LYNLEY CONTRACTING SERVICES LTD
LYNLEY CONTRACTING SERVICES,LYNLEY CONTRACTING SERVICES LTD.
LYNLEY CONTRACTING SERVICES,LNLEY CONTRACTING SERVICES
LYNLEY CONTRACTING SERVICES,Lynley Contract Services
