normalized_vendor_name,original_vendor_name
TRAINOR MECHANICAL CONTRACTORS,TRAINOR MECHANICAL CONTRACTORS LTD
TRAINOR MECHANICAL CONTRACTORS,TRAINOR MECHANICAL CONTRACTORS LTD.
TRAINOR MECHANICAL CONTRACTORS,Trainor Mechanical Contractors Ltd
TRAINOR MECHANICAL CONTRACTORS,Trainor Mechanical Contractors Ltd.
TRAINOR MECHANICAL CONTRACTORS,Trainer Mechancial Contractors Ltd.
TRAINOR MECHANICAL CONTRACTORS,Trainor Mechanical Contractors
TRAINOR MECHANICAL CONTRACTORS,Trainor Mechanical Contrators Ltd
