normalized_vendor_name,original_vendor_name
ELIZABETH FRY SOCIETY,ELIZABETH FRY SOCIETY
ELIZABETH FRY SOCIETY,SOCIETE ELIZABETH FRY DU QUEBEC
ELIZABETH FRY SOCIETY,ELIZABETH FRY SOCIETY OF CAPE BRETON
ELIZABETH FRY SOCIETY,ELIZABETH FRY SOCIETY OF OTTAWA
ELIZABETH FRY SOCIETY,ELIZABETH FRY SOCIETY OF GREATER TORONTO
ELIZABETH FRY SOCIETY,ELIZABETH FRY SOCIETY OF PEEL
ELIZABETH FRY SOCIETY,ELIZABETH FRY SOCIETY OF TORONTO
ELIZABETH FRY SOCIETY,ELIZABETH FRY SOCIETY OF KINGSTON
ELIZABETH FRY SOCIETY,ELIZABETH FRY SOCIETY OF MAINLAND NOVA SCOTIA
ELIZABETH FRY SOCIETY,ELIZABETH FRY SOCIETY OF SASK
ELIZABETH FRY SOCIETY,ELIZABETH FRY SOCIETY OF SAINT JOHN
ELIZABETH FRY SOCIETY,ELIZABETH FRY SOCIETY OF MAINLAND
ELIZABETH FRY SOCIETY,CANADIAN ASSOCIATION OF ELIZABETH FRY SOCIETIES
ELIZABETH FRY SOCIETY,ELIZABETH FRY SOCIETIES
ELIZABETH FRY SOCIETY,ELIZABETH FRY SOCIETY OF CALGARY
