,eco_obj_code,name,description
0,0,Services,
1,1,"Goods, land, buildings and works",
2,2,Transfer payments (standard object 10),
3,3,Other expenditures,
4,3A,Expenditures from internal sources or for accounting purposes,
5,4,Revenue,
6,5,Assets,
7,6,Liabilities,
8,7,Other,
9,8,Accumulated deficit,
10,9,Identification of partnering department for interdepartmental transactions,
11,01,Personnel,"Compensation, to or on behalf of employees (e.g., public servants, members of the Canadian Forces, members of the Royal Canadian Mounted Police (RCMP), judges, Members of Parliament and Senators, and the Governor General and Lieutenant Governors) for salaries and wages, overtime, severance pay, as well as allowances and other benefits under various collective agreements and other regulations. Also included are the government's contributions, as the employer, to various employee benefit plans, and supplementary personnel costs which relate to the cost of employee exchange agreements with other employers, or to various supplementary benefits. Note: A list of pay entitlement codes related to each object in standard object 01 is included as Appendix C of Chapter 7. The list is issued to ensure that the pay entitlement codes used for pay transactions are aligned to the appropriate object codes used for the expenditures and thus facilitate government-wide coding consistency."
12,02,Transportation and communications,"All travelling and transportation expenses of government employees and non-government employees, the postage, transportation of goods, and relocation expenses as well as the cost of communication services and courier services. Notes: The initial delivery cost on a purchase is included in the standard object covering the cost of the purchase itself."
13,03,Information,
14,04,Professional and special services,"All professional services performed by individuals or organizations such as payments (in the nature of fees, commissions etc.) for the services of accountants, lawyers, architects, engineers, scientific analysts, reporters, and translators; teachers; doctors, nurses and other medical personnel; for management, data processing and other research consultants; and for other technical, professional and other expert assistance. It includes also payments for hospital treatment, care of veterans and welfare services, payments for the provision of informatics services, payment of tuition for Indians at non-federal schools, purchase of training services under the Adult Occupational Training Act, payments made to the Canada School of Public Service for training, Payments for Corps of Commissionaires services and for other operational and maintenance services performed under contract, such as armoured cars, laundry and dry cleaning, cleaning of buildings, temporary help, hospitality, storage and warehousing, and other business services, as well as payments made to the Department of Public Works and Government Services for contract administration. Notes: - It includes all business services not included in standard objects 02, 03, 05 and 06; - Except for travel costs which must be charged to Standard Object 02 this Standard Object should be used for all costs incurred and invoiced by a contractor as part of the contract; "
15,05,Rentals,All expenditures for rentals and lease-purchases of all kinds.
16,06,Repair and maintenance,
17,07,Utilities (standard object 07),
18,11,Materials and supplies (standard object 07),
19,12,"Acquisition of machinery and equipment, including parts and consumable tools (standard object 09)",Note: The determination of whether the acquisitions are to be capitalized will comply with the Treasury Board Accounting Standard 3.1 - Capital Assets and will be reported using the appropriate financial reporting accounts.
20,13,"Acquisition of land, buildings and works (standard object 08)","Notes: 1. Sub-category 13 for Acquisition of land, buildings and works corresponds to all objects previously in standard object 08. This sub-category will continue to be aligned to standard object 08. Within the sub-category there are 4 objects that correspond with the previous ones. No change has been made to these objects other than to change their first 2 digits from ""08"" to ""13"". 2. Amounts for the construction of land, buildings and works should no longer be included in standard object 08 respectively unless the assets concerned are acquired in their entirety. Amounts for own account construction where assets are being constructed by a department using its own labour, materials, hired professional services, etc. should be charged to the pertinent object in sub-categories 01 to 12 which describes the pertinent type of service or good purchased as part of constructing the asset."
21,20,Transfer payments to persons,"These transfer payments include grants and contributions to persons for old age security pensions, family allowances, fishermen's benefits, etc. Payments to non-profit organizations include payments to national organizations such as sports organizations, national health or welfare organizations, universities, etc."
22,21,Transfer payments to industry,"Transfer payments to industry are payments for subsidies and capital assistance to various types of industries such as agriculture, oil and gas, and freight rates. Capital assistance payments are made for research and development, defence, shipbuilding, agriculture, railways, etc."
23,22,Transfer payments to provinces and territories,"Transfer payments to provinces and territories include payments for health insurance and social assistance, payments for education, fiscal transfer payments, etc. Transfer payments to municipalities include grants in lieu of taxes, assistance to encourage employment, etc."
24,23,Transfer payments to or on behalf of international organizations and foreign countries,"Transfer payments to international organizations and foreign countries are generally payments for the benefit of recipients in developing countries. These payments include the purchase of goods and services for development assistance, contributions to the North Atlantic Treaty Organization (NATO), payments to promote Canadian export sales, international Food Aid Program, etc."
25,24,"Transfer Payments to organizations, including Crown corporations and non-profit organizations",
26,26,Transfer payments to municipalities and local organizations,
27,28,Reallocation of transfer payments,
28,30,Transfers to Crown corporations and other entities (standard object 12),
29,31,Public debt charges (standard object 11),"All expenditures pertaining to the interest on the unmatured debt of Canada (including Treasury Bills) and on other liabilities such as trust and other special funds. It also includes the cost of issuing new loans, amortization of bond discount, premiums and commissions, and the costs of servicing the Public Debt."
30,32,Other subsidies and payment (standard object 12),"All expenditures for payments to certain non-budgetary accounts, as well as the write-offs of various types of losses, the annual adjustment of reserves for financial claims and some other miscellaneous expenditures."
31,34,Other expenditures From Internal Sources or for Accounting Purposes (Standard Object 12),
32,37,Reallocation of expenditures/Recognition of revenue - From internal sources (standard object 12),"Notes: 1. The objects in sub-category 37 should be used for internal transactions where a department is reallocating expenditures and has no net voting authority. For gross reporting purposes, these objects are included as credits in Standard Object 12. 2. The objects in sub-category 46 should be used for internal transactions when a department has explicit parliamentary authority to net vote."
33,42,Tax revenue,"Note: To record transactions related to the Goods and Services Tax (GST), sub-category 42 has been established. This represents the start of establishing objects to cover all tax revenue. Object 8171 has been added under sub-category 81 for GST payments."
34,45,Other revenue - Cost recovery and other user charges,"All other revenue from return on investments, revenue from rentals and concessions, proceeds from sales of products, revenue from public services, etc."
35,46,Other revenue - Cost recovery and other user charges,"All revenue received from internal sources including those from return on investments, certain other interdepartmental receipts, and tax revenue from sales tax and customs import duties."
36,48,Other revenue,
37,50,"Loans, investments, and advances",
38,51,Foreign exchange accounts,The accounts recording financial claims and obligations of the Government of Canada which are identified with Canada's foreign exchange operations. The four foreign exchange accounts include: - Exchange Fund Account-Advances; - International Monetary Fund-Subscriptions; - International Monetary Fund-Notes payable and; - Special Drawing Rights; Notes: - Each of these foreign exchange accounts is defined and their operations explained in sections 4200 to 4240 of the Guide to the Audited Financial Statements of the Government of Canada; - Although foreign exchange operations involve both financial claims and obligations they are included as a separate standard object to facilitate their identification coding and reporting; - The responsibility for all four accounts presently belongs to the Department of Finance. Therefore transactions should not be coded to these objects by other departments; 
39,52,Cash accounts,"Cash accounts represent public moneys of Canada, and include both Receiver General Cash Balances and Cash in Transit"
40,53,Accounts receivable,Accounts receivable are financial claims on parties inside or outside the government as a result of events and transactions prior to the accounting date. 1. This category is to be used only by departments for recording accounts receivable transactions through their own accounting system.
41,60,Specified purpose accounts (SPAs),The recorded value of the financial obligations of the Government of Canada in its role as administrator of certain public moneys that are received or collected and subsequently paid out for purposes specified in legislation or in other legal contracts. 1. For the purpose of this classification some specified purpose accounts have been included under reporting objects that differ from the equivalent groupings reported in the Public Accounts. These are explained under the reporting objects concerned. 2. Certain SPAs are now included in Standard Object 81 because they are now consolidated as budgetary transactions in the Summary Financial Statements.
42,61,Unmatured debt transactions,The financial obligations represented by certificates of indebtedness issued by the Government of Canada that have not yet matured. Note: These obligations are defined and their operations explained in sections 5300 to 5320 of the Guide to the Audited Financial Statements of the Government of Canada.
43,62,Transactions relating to other liabilities,"Transactions relating to other financial obligations of the Government of Canada such as matured debts, accounts payable, etc. Note: The accounts related to these transactions are defined and their operations explained in sections 5200 to 5240 of the Guide to the Audited Financial Statements."
44,70,Other accounts/transactions,"Other Accounts/Transactions represent transactions in accounts that are neither financial claims nor financial obligations. Note: Many of these accounts reflect deferred credits or deferred charges that have been set up in the accounts of Canada in accordance with specific legislative or other requirements. For reporting purposes in the Public Accounts, some have been offset against specific financial claims or obligations."
45,80,Unrestricted amounts,"Notes: 1. In accordance with the government's stated accounting policies, revenue and expenditures of certain Specified Purpose Accounts (SPAs) and Crown Corporations are included in the revenue and expenditure of the Government. However, enabling legislation requires that the revenue of SPAs be earmarked and that related payments be charged against such revenue. 2. Descriptions for the Consolidated Specified Purpose Accounts, the Consolidated Deposit and Trust Accounts, and the Consolidated Appropriation-dependent Crown Corporations are included in sub-categories 81, 82, 83, and 84. Descriptions for the Consolidated Accounts Receivable and the accrual of Related Other Revenue are included in sub-category 85."
46,81,Consolidated specific purpose accounts,"This standard object has been established because the transactions in these accounts are now consolidated as budgetary transactions in the Summary Financial Statements. Transactions in these accounts have been restricted as there are legislative requirements to keep them separate in the Accounts of Canada, so that amounts for previous years can be related to those in the current year. Notes: 1. Consolidation specified purpose accounts are defined and their operations explained in T.B. Circular 1989-13 dated August 2, 1989. 2. For consolidation reporting purposes, most of these amounts are included in other standard objects, as noted in section 8.2.3.4 of the Master List of Objects."
47,82,Consolidated deposit and trust accounts,
48,83,Consolidation of appropriation - Appropriation dependent and enterprise Crown corporations,"Notes: 1. For consolidation reporting purposes, most of these objects are included in other standard objects as noted in section 8.2.3.4 of the Master List of Objects. 2. The recording of transactions in these objects is to be done by the Receiver General only using department 097. Thus, it will have no impact on departments or agencies, or Appropriation-Dependent Crown Corporations (ADCC's). 3. The ADCC's are identified in the Public Accounts of Canada, Section 4. Consolidated-accounts."
49,84,Government elimination of inter-entity transactions and balances consolidation of appropriation - dependent Crown corporations,Appropriation-dependent Crown corporations Note: These objects are only to be used by the Receiver General in department 097.
50,,,
51,010,Salaries and wages,
52,012,Allowances and other benefits,
53,016,Employer contributions,
54,017,Reallocation of expenditures under Standard object 01,
55,018,Supplementary personnel costs,
56,020,Relocation,
57,021,"Postage, freight, express, and cartage",
58,022,Telecommunication services,
59,025,Travel - Public Servants,
60,026,Travel - Non-public servants,
61,029,Reallocation of expenditures under standard object 02,
62,030,Advertising services,
63,031,Publishing services,
64,032,Printing and imaging services,
65,033,Exposition and related services,
66,034,Communications research services,
67,035,Communications professional services,
68,036,Subscriptions and data access services,
69,039,Reallocation of expenditures under standard object 03,
70,040,Business services,
71,041,Legal services,
72,042,Engineering and architectural services,
73,043,Scientific and research services,
74,044,Training and educational services,
75,045,Health and welfare services,
76,046,Protection services,
77,047,Informatics services,
78,048,Management consulting,
79,082,Special fees and services,
80,086,Temporary help services,
81,087,Interpretation and translation services,
82,088,Construction services,
83,089,Other services,
84,050,Rental of land,
85,051,Rental of buildings,
86,052,Rental of informatics equipment,
87,053,"Rental of machinery, office furniture & fixtures, & other equipment",
88,054,Rental of motor and other vehicles,
89,055,Capital lease - Purchases,
90,056,Rental of aircraft and ships,
91,057,Rental - Other,
92,059,Reallocation of expenditures under Standard object 05,
93,060,Repair of engineering works,
94,063,Repair of buildings,
95,065,Repair of machinery and equipment,
96,069,Reallocation of expenditures under standard object 06,
97,070,Utility services,
98,079,Reallocation of expenditures under standard object 07,
99,111,"Food, feed, beverages and tobacco",
100,112,Mineral products,
101,113,Chemical products,
102,114,"Wood, paper and wood products",
103,115,Personal goods,
104,116,Metals and metal products,
105,117,Miscellaneous goods and products,
106,121,Acquisition of machinery and machinery parts,
107,122,Acquisition of informatics equipment and parts,
108,123,Acquisition of office equipment and furniture including parts,
109,124,Acquisition of equipment and furniture including parts,
110,125,"Acquisition of aircraft and ships, including parts",
111,126,Acquisition of other vehicles and parts,
112,127,Arms and ammunition,
113,129,Reallocation of expenditures under standard object 09,
114,130,Acquisition of land,
115,131,Acquisition of engineering works,
116,134,Acquisition of non-residential buildings,
117,137,Acquisition of residential buildings,
118,139,Reallocation of expenditures under standard object 08,
119,200,Payments to senior citizens,
120,201,Payments for pensions,
121,202,Transfer payments to promote employment,
122,203,Other transfer payments to persons,
123,210,Agricultural subsidies,
124,212,Other subsidies to industry,
125,217,Transfer payments for capital assistance,
126,221,Transfer payments to provinces and territories for Education,
127,222,Fiscal transfer payments,
128,224,Other Transfer payments to provinces and territories,
129,230,Transfer payments for development assistance to other countries,
130,231,Transfer payments to international organizations,
131,232,Other transfer payments to or on behalf of international organizations and foreign countries,
132,239,Foreign exchange gain/loss,
133,241,Transfer payments to universities,
134,242,Transfer payments to Aboriginal organizations,
135,243,Transfer payments to other non - profit institutions and other organizations,
136,245,Payments to Crown corporations,
137,261,Transfer payments to municipalities,
138,262,Transfer payments to other local organizations,
139,281,Reallocation of transfer payments Between Programs or Departments,
140,282,Transfer payments expenses recorded for accounting purposes,
141,300,"Transfers to Schedule III, Part I Corporations and their Wholly - Owned Subsidiaries",
142,304,"Transfers to Schedule III, Part II Corporations and their wholly - owned subsidiaries",
143,306,Transfers to other Crown corporations and other entities,
144,310,Interest on unmatured debt of Canada,
145,311,Interest on specified purpose accounts and other liabilities,
146,312,Interest on other accounts,
147,313,Bond discounts and premiums,
148,314,Cost of issuing and servicing the public debt,
149,321,Deficits and write - offs to losses,
150,323,Transfers to non-budgetary funds and accounts,
151,324,Discounts earned,
152,325,Miscellaneous expenditures,
153,326,Adjustment of reserves,
154,329,Reallocation of expenditures under Standard object 12,
155,342,"Amounts paid between or within departments for administrative overhead, or other charges",
156,343,Amounts charged to revolving funds by departments or agencies,
157,344,"Customs and excise duties, and federal sales tax",
158,345,Expenses charged to or from asset accounts for amortization or other purposes,
159,346,Expenses charged to or from liability accounts,
160,347,Transfer or incremental charges between appropriations,
161,348,Actuarial gains/losses on public sector pension and other employee and veteran future benefits,
162,371,Recoveries of expenditures between programs or departments,
163,372,Recoveries of expenditures from specified purpose and other accounts,
164,420,Tax revenue,
165,450,Revenues from charges of a regulatory nature,
166,451,Rights and privileges (including related royalty revenue),
167,452,Lease and use of public property,
168,454,Proceeds from sales of goods and information products,
169,455,Revenue from services of a regulatory nature,
170,456,Revenue from services of a non - regulatory (optional) nature,
171,457,Revenue from services of a non-regulatory nature provided to other governments and Crown corporations,
172,458,Administration fees and other charges,
173,459,Miscellaneous,
174,461,Recoveries of costs from departments and agencies,
175,462,Services to other government departments as per section 29.2 of the Financial Administration Act,
176,466,Revenue from sales of products and services provided to or within government departments and agencies by revolving funds,
177,480,Return on investments - Interest on loans and advances,
178,481,Return on investments - Profits and dividends,
179,482,Interest on Tax revenue,
180,483,Other interest income,
181,484,Proceeds from sale of assets,
182,485,"Fines, penalties and other court awards",
183,487,Transfer payments from other governments,
184,488,Receipts from non-budgetary funds and accounts,
185,489,Miscellaneous Other revenue,
186,501,Loans,
187,503,Advances,
188,505,Investments,
189,507,Investments of the Canada Pension Plan Investment Fund,
190,511,International Monetary Fund and Special Drawing Rights transactions,
191,516,Exchange Fund Account - Advances (restricted claims),
192,529,Cash account,
193,539,Accounts receivable,
194,601,Pension insurance and social security accounts,
195,606,Provincial tax collection agreements,
196,607,Crown corporations deposits,
197,608,Other deposits and trust funds,
198,609,Miscellaneous accounts,
199,611,Unmatured debt payable,
200,621,Interest due on unmatured debt (including compound interest on Canada Savings Bonds),
201,622,Matured debt,
202,629,Miscellaneous,
203,702,Allowance for valuation of assets and liabilities,
204,703,Unamortized deficiencies on superannuation accounts,
205,704,Unamortized Discount on Treasury bills,
206,706,Accumulated amortization,
207,709,Other transactions,
208,801,Unrestricted amounts in the Accumulated deficit,
209,802,Year - end closing of departmental accounts,
210,810,Consolidation of specified purpose accounts,
211,811,Employment Insurance Account,
212,815,Crop reinsurance fund,
213,816,Agricultural Commodities Stabilization Account,
214,817,Goods and services tax (GST) refundable advance accounts on purchases,
215,818,Seized Property Proceeds Account,
216,819,New Parks and Historic Sites Account,
217,820,"Gifts, donations and bequests accounts",
218,821,Insurance accounts,
219,822,Earmarked fees and levies,
220,829,Other restricted accounts,
221,831,Consolidation of appropriation - Appropriation dependent and enterprise Crown corporations,
222,832,Allowance for employee benefits,
223,833,Revenue and expenditures,
224,834,Cash balances,
225,835,Accounts receivable of appropriation - dependant Crown corporations (with outside parties),
226,836,"Loans, Investments and Advances by ADCC'S (With outside parties)",
227,837,Accounts payable of appropriation-dependant Crown corporations (with outside parties),
228,838,Borrowings of appropriation dependant Crown corporations (with outside parties),
229,840,Government elimination of inter-entity revenue and expenditure transactions,
230,842,Government elimination of inter-entity liability balances,
231,844,Government elimination of inter-entity asset balances,
232,0101,Civilian regular time - Continuing employment,"Basic salaries and wages for indeterminate civilian personnel who are employed full-time and includes the salaries of ministers, the Prime Minister, the President of the Privy Council, the President of the Treasury Board, the various secretaries of state and ministers without portfolio. This object does not include any remuneration for working non-standard hours, extra duty or holiday pay, retroactive salaries, or severance pay, bilingual bonus or allowances."
233,0102,"Civilian regular time - Part-time, seasonal, casual and student","Basic salaries and wages for civilian personnel employed part-time and those employed on a full-time seasonal, term, casual or student basis. This object does not include any remuneration for working non-standard hours, extra duty or holiday pay, retroactive salaries, or severance pay, bilingual bonus or allowances."
234,0103,Civilian premium pay for work during non-standard hours or other reasons,"Remuneration to civilian personnel that are entitled to a premium for working evening or night shifts, or on weekends, or designated holidays."
235,0104,Civilian holiday pay in lieu of leave,Remuneration to civilian personnel as compensation for annual vacation leave credits or statutory holidays (in lieu of time off).
236,0105,Civilian overtime (for additional hours),Remuneration to civilian personnel for time worked that is in addition to the standard hours of work.
237,0106,Civilian bilingual bonus,Remuneration to eligible civilian personnel in the form of a bonus for using both official languages as a requirement of their employment.
238,0107,Civilian severance pay and termination benefits,"Remuneration to civilian personnel for severance pay for termination of employment (retirement/resignation) OR termination benefits due to a special program encouraging departure before age of retirement (e.g., termination benefits provided for by an Early Retirement Incentive (ERI) program or Early Departure Incentive (EDI) program)."
239,0108,Civilian severance pay and termination benefits - Immediate Settlement,Remuneration to civilian personnel for the immediate cash-out of all or portion of severance pay benefits earned prior to termination of employment as permitted by collective agreements or under terms and conditions of employment.
240,0109,Military and Royal Canadian Mounted Police (RCMP) members retroactive payments - Current fiscal year,Retroactive pay increase for salaries and wages including overtime paid to military and Royal Canadian Mounted Police (RCMP) members when the pay increase is related to the current fiscal year.
