,eco_obj_code,name,description
616,2614,Payments to municipalities under Canada Infrastructure Program,"Payments to municipalities under the Canada infrastructure program. The Canada infrastructure program is a tripartite initiative of the federal, provincial and municipal governments to support economic recovery through job creation in critical sectors and to improve local infrastructure necessary for the delivery of quality public services. Broad infrastructure classes for this program include: road, bridge, sewer and water services, community facilities, sports and cultural centres, schools, colleges and universities, and other projects, including innovative technologies."
617,2619,Other Transfer payments to municipalities,All other payments to municipalities not specifically included in objects 2611 to 2614.
618,2621,Payments to non-native educational institutions,Payment to non-native educational institutions on behalf of native peoples. Note:Transfer payments to provinces and territories for non-native educational institutions on behalf of native peoples should be included in object 2216.
619,2622,Payments to non-native school boards,Payments to non-native school boards on behalf of native peoples. Note:Transfer payments to provinces and territories for non-native school boards on behalf of native peoples should be included in object 2217.
620,2811,Grants in lieu of taxes recovered from other departments,Grants in lieu of taxes recovered by Public Works and Government Services Canada (PWGSC) from other government departments.
621,2821,"Provision for valuation for loans, investments and advances",
622,2822,Expenses for accrued liabilities,
623,2823,Removal of low value amounts related to transfer payments,
624,2824,Provision for concessionary terms,"Provision for concessionary terms, including low interest rates, extended repayment terms, and forgiveness clauses."
625,3001,Atomic Energy of Canada Ltd.,
626,3003,Canada Mortgage and Housing Corporation,
627,3005,Canadian Commercial Corporation,
628,3009,National Capital Commission,
629,3010,Export Development Canada,
630,3011,Standards Council of Canada,
631,3012,VIA Rail Canada Inc.,
632,3014,The Jacques-Cartier and Champlain Bridges Inc.,
633,3017,Marine Atlantic Inc.,
634,3018,Canadian Dairy Commission,
635,3023,Canadian Museum for Human Rights,
636,3024,Canadian Museum of Civilization,
637,3025,Canadian Museum of Nature,
638,3026,National Museum of Science and Technology,
639,3027,National Gallery of Canada,
640,3029,Other,Transfers to Schedule III Part I Corporations and their wholly-owned subsidiaries that are not included in objects 3001 to 3027 inclusive.
641,3030,Canadian Tourism Commission Corporation,
642,3031,Enterprise Cape Breton,
643,3032,Canadian Museum of Immigration at Pier 22,
644,3041,Canada Post Corporation,
645,3059,Other,Transfers to Schedule III Part II Corporations and their wholly-owned subsidiaries that are not included in object 3041.
646,3061,Canada Council,
647,3062,Canadian Broadcasting Corporation,
648,3063,International Development Research Centre,
649,3064,National Arts Centre Corporation,
650,3065,Telefilm Canada,
651,3079,Other,Transfers to Other Crown Corporations and Other Entities that are not included in objects 3061 to 3065 inclusive.
652,3101,Marketable bonds payable in Canadian currency,"Interest on marketable bonds payable in Canadian currency. Such interest is generally payable to the holder semi-annually. The interest is paid when due, if the bonds are fully registered or upon presentation of an attached coupon, if it is a coupon bond. Such interest is accrued to budgetary expenditures and charged to this object on a monthly basis over the term of the bond. Note:Interest on these bonds is credited monthly to interest due on matured debt (objects 6211 or 6212)."
653,3102,Canada Savings Bonds (CSB),"Interest payable on CSBs. Such interest is generally payable annually to the holder of a regular bond, or at the time of maturity to the holder of a compound bond. However, if a CSB is redeemed on demand by the holder, any interest accrued up to the end of the previous month is paid. Interest on both regular and compound bonds is accrued to expenditure and charged to this object on a monthly basis over the terms of the bonds. Note: Interest accrued on these bonds is credited monthly to interest due on matured debt (object 6211)."
654,3103,Special nonmarketable securities,"Interest payable on special non-marketable securities issued by the Government of Canada exclusively to the Canada Pension Plan Investment Fund. Interest is generally payable semi-annually, but if the securities are redeemed before maturity, any accrued interest is paid."
655,3104,Treasury bills,"Amortization on a monthly basis over the terms of the relevant Treasury bills of the unamortized discounts on the Treasury bills. Notes:1. At time of issue Treasury bills are issued at a discount in lieu of interest payments. Thereafter the discount is amortized over the bill's term of 1, 3, 6 or 12 months.2. The discount on new Treasury bills is recorded in object 7041. The amortization of the discount is recorded in object 7042 when it is charged to this object."
656,3105,Marketable bonds payable in foreign currencies,"Interest on marketable bonds payable in foreign currency. Such interest is generally payable to the holder semi-annually. The interest is paid when due, if the bonds are fully registered or upon presentation of an attached coupon, if it is a coupon bond. Such interest is accrued to budgetary expenditures and charged to this object on a monthly basis over the term of the bond. Note: Interest on these bonds is credited monthly to interest due on matured debt (objects 6211 or 6212)."
657,3106,Notes and loans payable in foreign currencies,"Interest payable on borrowings by the Government of Canada under agreements with banks in Canada, United States, Switzerland, Japan and other international banks. Such interest is accrued to expenditures and charged to this object on a monthly basis over the term of the note or loan. Note: Interest accrued on these borrowings is credited to object 6212."
658,3107,Canada bills payable in foreign currency,Interest on Canada bills that is payable in foreign currency.
659,3111,Interest on superannuation and other pension accounts,"Interest paid on Superannuation Accounts (Public Service, Canadian Forces, and the Royal Canadian Mounted Police (RCMP)), other pension accounts, Supplementary Retirement Benefits Account, and the Government Annuities Account. Such amounts are charged in accordance with the pertinent sections of the related acts. Note: This amount is credited to object 6025."
660,3112,Interest on the Employment Insurance Account,Interest paid on the balance of the Employment Insurance Account. Note: This amount is credited to object 8114.
661,3113,Interest on the Canada Pension Plan Account,Interest paid on the operating balance of the Canada Pension Plan Account. Note: This amount is credited to object 6025.
662,3114,Interest on other liabilities,Interest payments on all other liabilities included in the accounts of Canada such as interest payments on deposit and trust accounts. It also includes the interest component on capital lease payments and the interest related to Alternative Financing Arrangements (Public Private Partnerships).
663,3121,Interest on Special Drawing Rights and other foreign exchange accounts,Interest on Special Drawing Rights and all other Foreign Exchange accounts. Note: The amounts are credited to various objects in standard object 51.
664,3131,Amortized Bond discounts and premiums,"Amortized amount of net losses or gains resulting from the issue of marketable bonds. Such amounts are charged to unamortized discounts and premiums (reporting object 705) at the time of the issue, and then amortized over the term of the bonds. Note: The discount is the difference between the cash proceeds of the sale and the face value of the bond that was issued and which is due at maturity."
665,3142,Commission and remuneration on bonds,Commissions paid on the sale of marketable securities and amortization of commission on Canada Savings Bonds (CSB). Note: Commissions paid on Canada Savings Bonds (CSB) are included in reporting object 703 until they are amortized over a 3 year period.
666,3143,Cost of servicing Canadian and foreign debt,"Cost of servicing Canadian and foreign debt, and standby credit."
667,3213,Losses of money,"Any loss of money that is covered by the Treasury Board Directive on Losses of Money and Property. It includes lost, stolen or misappropriated receipts; cash shortages; petty cash losses; and overpayments, erroneous payments, unauthorized expenditures resulting from fraud, defalcation or wilful misrepresentation, etc."
668,3214,Deficits and write-offs not elsewhere specified,Deficits and write-offs not specified in object 3213.
669,3215,"Deletion and write-offs of loans, investments and advances","Amounts deleted from the Accounts of Canada for a loan, investment or advance under the Debt Write-off Regulations of section 25 of the Financial Administration Act. This requires that the write off of any non budgetary items on the Statement of Assets and Liabilities, principally loans and investments, be approved by Parliament because the writing off of these debts results in an expenditure. Therefore, departments must continue to submit these items to the Treasury Board, regardless of the amount involved."
670,3216,Loss on foreign currency transactions,Loss from premium or discount on exchange of foreign currency transactions or from operations of foreign exchange accounts such as the Exchange Fund Account. Note: Foreign currency transactions are translated and recorded in Canadian currency equivalents at the exchange rates prevailing on the transaction dates. Any loss from a premium or a discount is recorded in this object. See object 4892 for gains on foreign currency transactions.
671,3217,"Forgiveness of loans, investments, and advances","Amounts deleted from the Accounts of Canada for a loan, an investment or an advance under the Forgiveness of debts and obligations section 24.1 of the Financial Administration Act or any other authority of parliament. Such amounts could be loans investments or advances to Crown corporations developing countries individuals or private sector enterprises."
672,3239,Transfers to non-budgetary funds and accounts,Any transfers to non-budgetary funds and accounts.
673,3241,Discounts/Rebates earned for early payment to suppliers or through the use of acquisition cards,"Discounts earned for early payments to suppliers in accordance with the policy on Payment On Due Date (PODD). It includes all discounts related to the purchase of goods or services included in Standard Objects 01 to 12. It includes the rebates received on purchases through use of the acquisition cards. This object will therefore have a credit balance. Note: When requisitioning payments, the gross amount is charged to the object relating to the goods or services acquired, the discount for early payment is credited or the use of an acquisition card to object 3241, and payment is made for the net amount."
674,3248,Damage and other claims against the Crown resulting from the Phoenix pay system transition,Expenditures related to the settlement of damage and other claims against the Crown resulting from the Phoenix pay system transition. Claims means claims for damages and includes requests that the Crown make payments as compensation for losses or expenditures incurred by employees of the Government of Canada.
675,3249,Court awards to industry,"Expenditures related to the settlement of court awards to business litigants. This object is required to separately identify court awards with the business sector. Notes: 1. A court award is an amount awarded by any court of jurisdiction which is to be paid by the Crown. 2. In 1995-96, these expenditures were included in object 3251."
676,3250,Court awards to persons,Expenditures related to the settlement of court awards to private litigants. This object is required to separately identify transactions with the personal sector. Notes:1. A court award is an amount awarded by any court of jurisdiction which is to be paid by the Crown.2. In 1995-96 these expenditures were included in object 3251.
677,3251,Damage and other claims against the Crown,"Expenditures related to the settlement of damage and other claims against the Crown. Claims means claims for damages and includes requests that the Crown make payments as compensation for losses or expenditures incurred by anyone; or claims governed by other authorities, such as losses and recovery of money, or damages to servants' effects on relocation."
678,3252,"Interest, administration or service charges, and other penalty charges","Amounts charged by suppliers in the form of interest, administration or service charges due to a delay in making a payment to the supplier. It includes all payments paid in accordance with the policy on Payments on Due Date (PODD)."
679,3253,Interest and service charges paid to financial institutions,Amounts paid to banks and other financial institutions in the form of interest and service charges. The use of this object is restricted to the Receiver General and should not be used by other departments to record interest or service charges on overdue accounts. Note: Service charges on overdue suppliers' accounts should be included in object 3252.
680,3254,Removal of low value amounts related to program expenditures,The Financial Administration Act (FAA) was amended to allow Treasury Board to make regulations to establish the threshold for low-value amounts (LVA). These regulations may also outline the circumstances where amounts would accumulate and amounts that are excluded from the application of the regulations.
681,3256,Canadian Security Intelligence Service,All expenditures related to the Canadian Security Intelligence Service.
682,3257,Ex gratia payments,Ex gratia payment means a payment made in the public interest for loss or expenditure incurred for which there is no legal liability on the part of the Crown. Note 1: Employee reward and recognition costs should be coded to object 0186.
683,3258,Communications Security Establishment,All expenditures related to the Communications Security Establishment.
684,3259,Miscellaneous expenditures not Elsewhere Classified,"All expenditures not elsewhere classified in any object in standard objects 01 to 12. It includes landing fees, prisoner costs, inmate pay, etc. Note: Effort should be made to classify all expenditures under their proper object. Object 3259 should be used as a last resort only."
685,3261,Adjustment of provision for valuation of financial claims,"Provision for valuation of assets such as loans, investments and advances. Note: The other side of this adjustment will be made to object 7021."
686,3262,Adjustment of reserves for Loan Guarantees,Provision for borrowings of agent Crown corporations that the government expects it may be required to repay in accordance with the terms of a loan guarantee given to the lenders to the Crown corporation. This code is to be used by the Treasury Board Secretariat only. Note: The other side of this adjustment will be made to object 7021.
687,3263,Allowance for increase in value of certain financial obligations,"Provisions for the increase or decrease in the value of certain allowances related to financial obligations, such as employee vacation and termination benefits, and the payments under certain statutory authorities. This code is to be used by the Treasury Board Secretariat only. Note: The other side of this adjustment will be made to object 7021."
688,3269,Other adjustments,Any other adjustment to an allowance or reserve that is not specifically included in objects 3261 to 3263.
689,3299,Other subsidies and payments - Reallocation of capital expenditures,"For each Standard Object (01 to 09, 12), a generic Object code has been created to reallocate the capital expenditures that were initially expensed when using the indirect method and to transfer the construction costs at month end to the work in progress asset account."
690,3421,General administrative services charged by other departments or by other programs within a department,Any general administrative services acquired by a department from another department or by a program within a department from another program.
691,3422,Suspense account (debit) - Other government departments,An amount advanced temporarily to another government department so that it can purchase goods or services on behalf of the first department. This object will always have a debit balance. Note: 1. See object 3718 for the credit side of the entry.
692,3424,Suspense activity allocation,The allocation of a transaction to a valid activity account which was set up as part of the program-activity classification. Such amounts are initially included in a suspense activity account until its ultimate disposition is determined. Notes:1. This code is to be used only by departments that have a suspense activity account in the Master List of Programs and activities (See Section 6.2).2. See object 3714 for the other side of the transaction.
693,3425,Reallocation of expenditures/costs within a department,The reallocation of expenditures or costs within a department for cost accounting purposes. This includes the transfer of costs from a work in progress asset account to a capital asset account.
694,3427,Reallocation of costs under shared cost programs,The reallocation of costs within or between departments under shared cost programs.
695,3428,Payments in lieu of taxes paid to Public Works and Government Services Canada (PWGSC),Departmental expenditures for grants in lieu of taxes paid to PWGSC.
696,3429,Other,Other amounts paid between or within department which are not specifically included in objects 3421 to 3428.
697,3431,Overhead or other amounts charged directly to revolving funds by departments or agencies,"Any amount charged to a revolving fund by a department or a program for such expenses as overhead, terminal control costs, etc."
698,3432,Interest charged to revolving funds by department of finance,All interest paid by revolving funds to the Department of Finance on the account that represents the revolving funds Accumulated Net Charge against the Fund's Authority. Note: See chapter 11 of the Guide on Financial Administration for more explanation of these charges.
699,3433,Reallocation of expenditures/costs within revolving funds,An object used by revolving funds to record the allocation or reallocation of their expenditures or costs for cost accounting or other reasons.
700,3439,Other,Amounts charged to or within revolving funds which are not specifically included in objects 3431 to 3433.
701,3441,Customs import duties,"The payment of custom import duties to Canada Revenue Agency, by departments and agencies."
702,3442,Excise duties and federal sales tax,"The payment of excise duties and federal sales tax to Canada Revenue Agency, by departments and agencies."
703,3451,Amortization expenses for capital assets,Expense charged to operations each year based on the amortization of its capital assets by a department.
704,3452,Usage of inventory,"Expense charged to operations each year based on the inventories usage by a department, either in its operation or for resale."
705,3453,Recognition of unamortized expenses related to assets,
706,3459,Amortization of other assets accounts,All other expense charged to operations each year based on the amortization in usage of recorded assets by a department.
707,3461,Allowance for vacation pay and similar employee benefits,Estimate of vacation pay and other accrued employee benefits.
708,3462,Allowance for bad debts,Estimated portion of accounts receivable that will not be collected by a department.
709,3463,Charges to remediation liabilities,Miscellaneous recoveries and credits to expenses as a result of accruals to a Contra Remediation Liability account.
710,3469,Charges to other liability accounts,Miscellaneous charges to expenses as a result of month end or year end accruals.
711,3471,Incremental charges from other appropriations,"Charges for all incremental expenditures from other budgetary appropriations either within the department or between departments. These types of charges can be the types of expenditures included in Standard Objects 01 to 12, if they were charges from outside parties."
712,3472,Incremental recoveries from other appropriations (credit),Recovery of all incremental expenditures from other budgetary appropriations within a department or from other departments. This amount will have a credit balance.
713,3481,Actuarial gains/losses on public sector pension and other employee and veteran future benefits,
714,3711,Overhead or other amounts recovered by departments and agencies from revolving funds,Overhead or other charges recovered by departments and agencies from Revolving Funds.
715,3712,Amounts recovered for general administrative services by other departments or by other programs within a department,
716,3714,Suspense activity allocation,An account in the object classification which records a credit entry when an amount in the suspense activity account (Program-Activity classification) is allocated to the correct activity. Notes:1. This code is to be used only by departments that have a suspense activity account in the Master List of Programs and Activities (Section 6.2).2. See object 3424 for the other side of the transaction.
717,3715,Recoveries of costs under shared cost programs,The reallocation of costs within or between departments under shared cost programs.
718,3717,Recoveries of expenditures/costs within a department,Amounts credited in the reallocation of expenditures or costs within a department. Note: Refer to object 3425 for further explanations on these transactions.
719,3718,Suspense account (credit balance) - Other government departments,An amount received from another government department on a temporary basis for purchasing goods or services for that department. This object will always have a credit balance. References: Treasury Board Secretariat Accounting Manual chapter 9.9. Funds Administered by Departments on Behalf of Other Government Departments and Receiver General Manual Chapter 14. Year-End Timetable and Procedures.
720,3719,Other,
721,3721,Recovery of expenses through recognizing revenue from restricted specified purpose accounts,
722,4200,Tax revenue (Total),
723,4500,Fuel Charge and Excess Emission Charges,
724,4510,Licence fees,"Revenue from licence fees such as airport licences, aviation personnel licences, etc."
725,4513,"Fees for passports, visas and citizenship certificates","Revenue from fees for passports, visas, and citizenship certificates."
726,4515,Oil royalties,Revenue received from oil royalties.
727,4516,Natural resources royalties,Revenue received from royalties on natural resources.
728,4517,Other royalties,Revenue received from all royalties other than those for oil and natural resources royalties included in objects 4515 and 4516.
729,4518,"Fees for the registration of trademarks, patents and copyrights","Revenue from registrations of trademarks, patents and copyrights such as aircraft registration certificates, etc."
730,4519,Other revenue from rights and royalties,"Other returns received from natural resources that is not included in objects 4510 to 4518, such as that received for fish and game, etc."
731,4520,Oil and gas leases,Revenue received from oil and gas leases.
732,4521,Land leases,Revenue received from land leases.
733,4525,Rental of unimproved (vacant) land,Rental income from land that has no improvements.
734,4526,Rental of works,Rental income from the lease of works.
735,4527,Rental of machinery and equipment,Rental income from the lease of machinery and equipment.
736,4528,Rental of concessions in government - owned facilities,
737,4529,Rental of parking space,Rental income from the lease of parking space for vehicles.
738,4530,Rental of residential buildings,Rental income from the lease of residential buildings.
739,4531,Rental of non-residential buildings,"Rental income from all buildings, except residential buildings. This includes office, administrative, commercial, industrial and institutional buildings. It also includes rentals from storage space, hangar bays, etc."
740,4535,Rental of real property to Crown corporations,
741,4539,Other Returns from Lease and use of public property,Revenue from rentals and concessions for facilities not specified in objects 4520 to 4535 inclusive.
742,4540,"Sale of uniforms, clothing, etc.",
743,4542,Sales of electricity,
744,4543,Sales of Natural gas,
745,4544,"Government publications, maps and charts","Sales of publications, maps, and charts such as atlas sales, survey data, books, air photos and prints, audio-visuals, duplication of records in electronic or print form."
746,4545,Other goods manufactured by government,
747,4546,Sales of information products,"Sales of products in electronic formats, such as computerized lists."
748,4547,"Petroleum, oil and lubricants",
749,4548,Public meals,
750,4549,Sales of other goods,"Sale of products or services not included in objects 4540 to 4548 such as tags and seals, photocopies, sale of unclaimed goods, etc."
751,4551,Inspection fees,"Revenue from inspection fees, such as aircraft type approval, airworthiness certificates, etc."
752,4554,Aviation regulations,
753,4556,Supervision of race tracks,
754,4558,Fees from assessments of financial institutions,
755,4559,Other services of a Regulatory Nature,Any revenue from services of a regulatory nature not included in objects 4551 to 4558.
756,4560,"Public Utility services, Including Water, Waste Water and Other Utilities",
757,4561,Telecommunication services,
